{"schema_version":1,"relay_id":"agent-relay:e6639e5e625fcfd3edf4b693fdb11572dd22b6488d91846e34ec8658c858e838","context":{"request_id":"agent-request-1","session_id":"agent-session-1","agent_id":"owner-agent","content_ref":"blake3:agent-content","tenant_id":null},"from_agent_id":"owner-agent","to_agent_id":"owner-agent","capsule_ref":"capsule:aaaaaaaaaaaaaaaaaaaaaaaaaaaaaaaaaaaaaaaaaaaaaaaaaaaaaaaaaaaaaaaa","budget_tokens":900}