{"schema_version":1,"relay_id":"agent-relay:00901ca0e7ca2a6e2e91481d48623ad54064a02f247e56c5fbb62c54c4b79b98","context":{"request_id":"agent-request-1","session_id":"agent-session-1","agent_id":"owner-agent","content_ref":"blake3:agent-content","tenant_id":null},"from_agent_id":"owner-agent","to_agent_id":"reviewer-agent","capsule_ref":"capsule:aaaaaaaaaaaaaaaaaaaaaaaaaaaaaaaaaaaaaaaaaaaaaaaaaaaaaaaaaaaaaaaa","budget_tokens":900}